{
  "comparisonId": "cmp-scaffold-demo-sha-pair",
  "hypothesis": "Inspect pass and token count for the demo scaffold should move. Latency is out of scope.",
  "classifications": ["scaffold", "components"],
  "scenarioId": "react-node-monorepo",
  "model": "example-model",
  "legs": [
    {
      "name": "baseline",
      "treeSha": "aaaaaaaaaaaaaaaaaaaaaaaaaaaaaaaaaaaaaaaa"
    },
    {
      "name": "candidate",
      "treeSha": "bbbbbbbbbbbbbbbbbbbbbbbbbbbbbbbbbbbbbbbb"
    }
  ]
}
